{
  "generatedAt": "2026-10-16T18:15:26.103Z",
  "title": "Prescribed burning taking place Monday at Bear Creek Lake Park",
  "publishedAt": "2026-10-12T17:35:20.000Z",
  "url": "https://colosmokeoutlook.blogspot.com/2026/10/prescribed-burning-taking-place-monday.html",
  "snippet": "West Metro Fire Rescue is planning to conduct a prescribed fire on 10-12-2026 at Bear Creek Lake Park, in Lakewood, CO. This operation will treat 120 acres of grassland, near C-470 and Highway 285. Smoke from this operation will be visible from locations in western, southern, and southwestern portions of the Denver Metro area, including Lakewood, Morrison, and Indian Hills. This operation may continue on Tuesday, 10-13-26. Short video of ignition taking place at Bear Creek Lake Park. Video…",
  "guid": "tag:blogger.com,1999:blog-1924728690591852821.post-5262523988490105711",
  "source": {
    "name": "CDPHE Colorado Smoke Blog",
    "homeUrl": "https://colosmokeoutlook.blogspot.com/",
    "feedUrl": "https://colosmokeoutlook.blogspot.com/feeds/posts/default?alt=rss"
  }
}
